URL,Version,Status,OIDs,Name,Title,Descriptino,Used
http://hl7.org/fhir/CodeSystem/example,1.1.0,draft,,ACMECholCodesBlood,ACME Codes for Cholesterol in Serum/Plasma,"This is an example code system that includes all the ACME codes for serum/plasma cholesterol from v2.36.",
https://mos.esante.gouv.fr/NOS/TRE_R85-RolePriseCharge/FHIR/TRE-R85-RolePriseCharge,1.1.0,active,"1.2.250.1.213.1.6.1.107",TRE_R85_RolePriseCharge,TRE R85 RolePriseCharge,"Rôle dans la prise en charge des patients ou des usagers",
https://smt.esante.gouv.fr/terminologie-cim-10,1.1.0,active,"2.16.840.1.113883.6.3",CIM-10,null,"La Classification Internationale des Maladies (CIM) sert de base pour établir les tendances et les statistiques sanitaires, partout dans le monde. Elle est gérée par l’Organisation Mondiale de la Santé qui publie une mise à jour annuellement",
https://smt.esante.gouv.fr/terminologie-cladimed,1.1.0,active,"1.2.250.1.213.2.65",CLADIMED,null,"La classification CLADIMED décrit le domaine des produits de santé (dispositifs médicaux (DM) et autres produits de santé (hors médicaments)). C’est une classification mono axiale inspiréede la classification internationale ATC des médicaments (Anatomique, Thérapeutique, Chimique).",
https://smt.esante.gouv.fr/terminologie-emdn,1.1.0,active,"1.2.250.1.213.2.68",EMDN,null,"EMDN Terminology",
